{
  "kind": "pkg",
  "schema_version": 1,
  "sha256": "45fbb9feea96c236eaf7092b9be45dfd777318790cbb0948fce24215f38bdb18",
  "sha1": "95aa228c8685e848a188363df381e0d624a85016",
  "size_bytes": 39412032,
  "metadata": {
    "content_id": "HP9000-UCAS40262_00-LBPPDLCSONYPA005",
    "content_type": 7,
    "title_id": "UCAS40262",
    "title": "LittleBigPlanet™ "
  }
}
