{
  "kind": "pkg",
  "schema_version": 1,
  "sha256": "1ed6da1fd1a32e76077591bf2799dd9c7666ff8c4ff97d8404c3617b3397b35a",
  "sha1": "9b2e6a14b6f645a0ca5e2a97d09661be325db89c",
  "size_bytes": 2552816,
  "metadata": {
    "content_id": "JP0394-NPJH50803_00-SAKI2PATCH000101",
    "content_type": 7,
    "title_id": "NPJH50803",
    "title": "咲-Saki- 阿知賀編 episode of side-A Portable"
  }
}
