{
  "kind": "pkg",
  "schema_version": 1,
  "sha256": "94003379fbf943fbaa7dde6ae6243e7ea384f0ff14018640a287f6f498e9152c",
  "sha1": "d3c199836931862177421bd27a68c954d93dcab4",
  "size_bytes": 6574480,
  "metadata": {
    "content_id": "JP0571-NPJJ00469_00-0000000000000001",
    "content_type": 6,
    "package_flags": 524,
    "title_id": "NPJJ00469",
    "disc_id": "SLPS03482",
    "disc_version": "1.00",
    "title": "最強銀星チェス",
    "required_firmware": "6.31"
  }
}
