{
  "kind": "pkg",
  "schema_version": 1,
  "sha256": "e4cb69524dcad2f323c95b5a5d64fbeca2a3a1531d77a68b8283632e9e83666c",
  "sha1": "817e8256869509e103c85796f4976d4e01fa3084",
  "size_bytes": 88403456,
  "metadata": {
    "content_id": "JP0102-NPJJ00608_00-0000000000000001",
    "content_type": 6,
    "package_flags": 524,
    "title_id": "NPJJ00608",
    "category": "1P",
    "boot_category": "ME",
    "boot_file": "USRDIR/CONTENT/EBOOT.PBP",
    "disc_id": "SLPS00203",
    "disc_version": "1.00",
    "title": "天地を喰らう Ⅱ 赤壁の戦い",
    "required_firmware": "6.60"
  }
}
