{
  "kind": "pkg",
  "schema_version": 1,
  "sha256": "ad1403fa37d24d1bd808cff07e023a47905ed35889572c0668fc0a5933b691aa",
  "sha1": "e93be7c662c861e9d626c8cea695624d227e5cfe",
  "size_bytes": 18287776,
  "metadata": {
    "content_id": "UP9000-NPUG70014_00-HSGOT2INTERMED08",
    "content_type": 7,
    "package_flags": 524,
    "title_id": "NPUG70014",
    "category": "PP",
    "boot_category": "EG",
    "boot_file": "USRDIR/CONTENT/EBOOT.PBP",
    "disc_id": "NPUG70014",
    "disc_version": "1.00",
    "title": "HSG:OT2 Intermediate Demo",
    "required_firmware": "3.80"
  }
}
