{
  "kind": "pkg",
  "schema_version": 1,
  "sha256": "25e35f0cc277ce30942b0e825f18ec4b806cc9b0b105734f3a04cacd22319df5",
  "sha1": "6dbdfe6f5c5bae300673bba0908e661cd13f1ad1",
  "size_bytes": 6893040,
  "metadata": {
    "content_id": "JP0177-NPJH50076_00-PATCH00000000000",
    "content_type": 7,
    "package_flags": 540,
    "title_id": "NPJH50076",
    "category": "PP",
    "boot_category": "PG",
    "boot_file": "USRDIR/CONTENT/PBOOT.PBP",
    "title": "J.LEAGUE プロサッカークラブをつくろう！ 6 Pride of J"
  }
}
