{
  "kind": "iso",
  "schema_version": 1,
  "sha256": "201c41da838c7cad85261cc4c7589d125cef4ae076f4330e92d9c9ffdbb78a4b",
  "sha1": "55ffd74929a2193572021eff59317d4cbbc1a227",
  "size_bytes": 1137377280,
  "metadata": {
    "identifier": "ULUS-10593",
    "umd_uid": "04D75DE31BCE6592",
    "type_code": "0001",
    "media_code": "G",
    "disc_id": "ULUS10593",
    "disc_version": "1.00",
    "title": "Growlanser: Wayfarer of Time",
    "required_firmware": "6.60"
  }
}
