{
  "kind": "pkg",
  "schema_version": 1,
  "sha256": "5b7bb8ab9d5e131704607e7aec21267b566a3eac4bf507fabacd291ac13561fd",
  "sha1": "0d4e18136340f3fe1cab9319577bc66fe3ecc139",
  "size_bytes": 29665168,
  "metadata": {
    "content_id": "EP4095-NPEZ00098_00-FIELDRUNNERS0001",
    "content_type": 15,
    "package_flags": 590,
    "title_id": "NPEZ00098",
    "category": "MN",
    "boot_category": "EG",
    "boot_file": "USRDIR/CONTENT/EBOOT.PBP",
    "disc_id": "NPEZ00098",
    "disc_version": "1.00",
    "title": "Fieldrunners",
    "required_firmware": "6.00"
  }
}
