{
  "kind": "pkg",
  "schema_version": 1,
  "sha256": "03bc9771276d0f0eea644f012814650ca63c2dbde6a3ceae8c45102bc6395599",
  "sha1": "f20efb6bcf5f13624c7dac677b442dc120cd5957",
  "size_bytes": 112904432,
  "metadata": {
    "content_id": "JP9000-NPJG00126_00-0000011111222222",
    "content_type": 7,
    "package_flags": 524,
    "title_id": "NPJG00126",
    "category": "PP",
    "boot_category": "EG",
    "boot_file": "USRDIR/CONTENT/EBOOT.PBP",
    "disc_id": "UCJS10078",
    "disc_version": "2.01",
    "title": "MyStylist®",
    "required_firmware": "6.60"
  }
}
