{
  "kind": "iso",
  "schema_version": 1,
  "sha256": "2cf02ccf872b721883ec46baffa5589c46fa160f977bdd97f95a4aee782a54a2",
  "sha1": "1f27437b13011906f417a20c34ae2bb1ee007180",
  "size_bytes": 591036416,
  "metadata": {
    "identifier": "ULES-00248",
    "umd_uid": "48218F4831FD0526",
    "type_code": "0001",
    "media_code": "G",
    "disc_id": "ULES00248",
    "disc_version": "1.02",
    "title": "FootballManagerHandheld",
    "required_firmware": "2.50"
  }
}
