{
  "kind": "pkg",
  "schema_version": 1,
  "sha256": "2323610799a526c2d7187c095bb0dc444a5740643d3d3ca4324137119e7dd445",
  "sha1": "7b5bac324ff9838a27335c5d091b5cf4924c9944",
  "size_bytes": 96352704,
  "metadata": {
    "content_id": "EP9000-NPEE00004_00-GWIPEOUTPSE00001",
    "content_type": 6,
    "package_flags": 524,
    "title_id": "NPEE00004",
    "category": "1P",
    "boot_category": "ME",
    "boot_file": "USRDIR/CONTENT/EBOOT.PBP",
    "disc_id": "SCES00010",
    "disc_version": "1.00",
    "title": "WipeOut®",
    "required_firmware": "3.50"
  }
}
