{
  "kind": "pkg",
  "schema_version": 1,
  "sha256": "e8202ae5c55c8bd53cfe0a4ace22faaf628df1dff3a1bb9533f7fbada5db0f5a",
  "sha1": "b2b9c60606fd99d3a2a90191c053ec3665d15bc7",
  "size_bytes": 448112,
  "metadata": {
    "content_id": "EP9000-NPEW00068_00-TPCPSPGOPR000001",
    "content_type": 9,
    "package_flags": 524,
    "title_id": "NPEW00068"
  }
}
