{
  "kind": "pkg",
  "schema_version": 1,
  "sha256": "98b26ba23621f03a2eac9e8b680b4bc46b58d10520270752461f8727b004f444",
  "sha1": "f1448d02d9a36b03672b2f8031ef16f5920fc0fe",
  "size_bytes": 16034560,
  "metadata": {
    "content_id": "UP0576-NPUH10066_00-NEOGEOSTATION008",
    "content_type": 16,
    "package_flags": 590,
    "title_id": "NPUH10066",
    "category": "HG",
    "boot_category": "EG",
    "boot_file": "USRDIR/CONTENT/EBOOT.PBP",
    "disc_id": "NPUH10066",
    "disc_version": "1.01",
    "title": "SUPER SIDEKICKS",
    "required_firmware": "6.30"
  }
}
